<?xml version="1.0" encoding="UTF-8"?>
<AllParamsClasses
    xmlns:xsi='http://www.w3.org/2001/XMLSchema-instance'
    xsi:noNamespaceSchemaLocation='AllParamsClasses.xsd'>
    <NeuronsParamsClasses name="NeuronsParamsClasses" templateDirectory="ParamsClassTemplateConfig/NeuronsParamsClass/">
        <ParamsClass name="ALLLIFNeurons" templateFileName="AllLIFNeurons.xml"/>
        <ParamsClass name="AllIZHNeurons" templateFileName="AllIZHNeurons.xml"/>
    </NeuronsParamsClasses>
    <SynapsesParamsClasses name="SynapsesParamsClasses" templateDirectory="ParamsClassTemplateConfig/SynapsesParamsClass/">
        <ParamsClass name="AllSpikingSynapses" templateFileName="AllSpikingSynapses.xml"/>
        <ParamsClass name="AllDSSynapses" templateFileName="AllDSSynapses.xml"/>
        <ParamsClass name="AllSTDPSynapses" templateFileName="AllSTDPSynapses.xml"/>
        <ParamsClass name="AllDynamicSTDPSynapses" templateFileName="AllDynamicSTDPSynapses.xml"/>
    </SynapsesParamsClasses>
    <ConnectionsParamsClasses name="ConnectionsParamsClasses" templateDirectory="ParamsClassTemplateConfig/ConnectionsParamsClass/">
        <ParamsClass name="ConnGrowth" templateFileName="ConnGrowth.xml"/>
        <ParamsClass name="ConnStatic" templateFileName="ConnStatic.xml"/>
    </ConnectionsParamsClasses>
    <LayoutParamsClasses name="LayoutParamsClasses" templateDirectory="ParamsClassTemplateConfig/LayoutParamsClass/">
        <ParamsClass name="FixedLayout" templateFileName="FixedLayout.xml"/>
        <ParamsClass name="DynamicLayout" templateFileName="DynamicLayout.xml"/>
    </LayoutParamsClasses>
</AllParamsClasses>

